{
  "$schema": "./logserv_intent_map.schema.json",
  "version": "0.0.14",
  "description": "LogServ AI Assistant predefined-prompt registry. Each entry maps a canonical user question to a saved search the official Splunk MCP Server (Splunkbase App 7931) can run. The chat-side time-range dropdown overrides any `earliest=`/`latest=` baked into the SPL via Splunk dispatch tokens. Entries are immutable per app release; per-customer overrides are deferred to v2 (see ai_assistant_design_v0.1_20260427.md \u00a77.6). v0.0.6 (Build 141) upgrades nextSteps entries to support deep-dive link objects: `{text, savedSearch}` resolves at runtime to that prompt's SPL; `{text, spl}` carries an ad-hoc deep-dive query. Both open Splunk's search app in a new browser tab with the dispatch's earliest/latest applied. v0.0.7 (Build 156) adds an optional `dashboard` field per prompt: either a single OOTB dashboard slug (e.g. \"hana-audit\") or an array of slugs for cross-cutting prompts (e.g. [\"hana-audit\", \"cross-stack-authentication\"]). Slugs match `dashboardRegistry.ts`. v0.0.8 (Build 158 / session 027 task 5) adds 6 new prompts targeting thin-coverage dashboards: integration-topology (top systems by calls + RFC partner failures), sap-services (host severity breakdown), cloud-connector + web-api-performance (SCC backend latency + top destinations), and environment-health (top error categories). Powers the new \"Dashboard Focused\" tab in the prompt browser. v0.0.9 (Build 170 / session 028) rewrites two nextStep SPLs from `| map maxsearches=1 search=\"...\"` to subsearch syntax (`[ search ... | top limit=1 host | fields host ]`) so they no longer trigger Splunk's risky-command safeguard modal \u2014 `map` is on Splunk's flagged list because it spawns per-row subsearches; subsearches are equivalent here and not flagged. v0.0.11 (Build 249 / session 068) enables the 22 ES searches by default (re-staggered into a collision-free schedule) and reworks the 13 ES Security prompts to work as interactive prompts: fixed the anomaly_topology_edge_volume FATAL inputlookup-where error; replaced the broken is_business_hours/is_weekend EVAL-chain fields (constant-valued on real data) with inline _time-based off-hours logic in hana_user_creation_off_hours, after_hours_admin_data_access, and anomaly_after_hours_admin; fixed service_account_interactive to detect service accounts via executing_user; and converted the 3 heavy 30-day anomaly scans to a daily cadence. v0.0.12 (session 084) converts 23 high-volume prompts from raw index scans to KV-Store rollup reads (| inputlookup <rollup> | addinfo | where bucket_ts in the dispatch window) so they complete inside the AI Assistant's 30s MCP client timeout at customer scale; adds 5 new rollup metric arms (linux pam + cgs_firewall, wp_perf workprocess-errors, proxy denied-by-dest, windows logon); webdispatcher_slow_uris now reports avg+max response time instead of p95 (percentiles don't roll up across hourly buckets); dns_beaconing_24h now uses the beaconing-detail gap-variance rollup (the dashboards' detection math, daily granularity). v0.0.13 (session 084 round 2) re-bins the ten >100-row time-series prompts to bins=90 minspan=1h so their complete window survives the MCP server's default 100-row response cap (the first-100-rows slice of an hourly 30-day trend showed only the oldest ~4 days), converts the after-hours-admin ES prompt's web-traffic join subsearch to the sourcetype-mapping rollup, and re-expresses the webdispatcher response-time anomaly on a new per-host hourly web-timing rollup metric (avg+max z-score instead of p95 \u2014 percentiles don't roll up) so both ES prompts complete well inside the 30-second dispatch timeout.",
  "packs": {
    "sap_basis": {
      "label": "SAP Basis",
      "description": "Operational queries for SAP basis admins \u2014 work process health, HANA admin activity, ICM, dispatcher, gateway, enqueue, message server, trace logs, host control."
    },
    "security": {
      "label": "Security",
      "description": "Cross-stack security analytics \u2014 authentication failures, permission grants, beaconing, firewall + proxy correlation, account lifecycle, SAP Router protocol anomalies."
    },
    "operations": {
      "label": "Operations",
      "description": "Infrastructure ops queries \u2014 data freshness, volume anomalies, response-time trends, error-rate dashboards, host health, ICM mix."
    }
  },
  "prompts": [
    {
      "id": "sap_basis.abap_workprocess_errors",
      "pack": "sap_basis",
      "label": "ABAP work process errors by SID and host",
      "description": "Aggregates sap:abap:workprocess events whose raw text contains the keyword \"ERROR\", grouped by SAP SID and host. Useful for spotting which systems and hosts are generating the most operational error noise. Field-level severity isn't extracted on this sourcetype, so a keyword match is the most reliable signal.",
      "savedSearch": "logserv_abap_workprocess_errors",
      "spl": "| inputlookup logserv_wp_perf_rollup where metric=\"wperr\" | addinfo | where bucket_ts>=info_min_time AND bucket_ts<info_max_time | search sap_sid!=\"(none)\" host!=\"(none)\" | stats sum(count) as count by sap_sid host | sort -count",
      "renderHint": "table",
      "interpretation": "ABAP work process events containing the keyword ERROR, grouped by SAP SID and host. The work-process layer is where ABAP application logic actually runs, so ERROR-keyword events here often indicate ABAP dumps, RFC failures, or DB connection problems. The host that dominates is usually the one to investigate first.",
      "nextSteps": [
        {
          "text": "Drill into the busiest SID/host \u2014 pull the raw events at that bucket via free-form SPL to read the actual error text.",
          "spl": "`sap_logserv_idx_macro` sourcetype=sap:abap:workprocess \"ERROR\" | head 100 | table _time host sap_sid _raw"
        },
        {
          "text": "If one host dominates, cross-check with the dispatcher_softcancel_reasons prompt to see whether ICM/dialog cancels are correlated.",
          "savedSearch": "logserv_dispatcher_softcancel_reasons"
        },
        "Persistent errors on BATCH_* users typically point to a job runtime issue \u2014 review SM37 / job logs in the corresponding SAP system."
      ],
      "dashboard": [
        "work-process-performance",
        "abap-operations"
      ]
    },
    {
      "id": "sap_basis.dispatcher_softcancel_reasons",
      "pack": "sap_basis",
      "label": "ABAP dispatcher soft-cancel reasons trend",
      "description": "Per-hour count of sap:abap:dispatcher soft-cancel events broken down by reason (e.g. AUTO_LOGOFF, ICM_CANCEL_REQUEST, SAP_GUI_DISCONNECT, GW_CANCEL_BY_RFC_PEER). The reason mix shifts when frontend connectivity, ICM throttling, or RFC peer health changes \u2014 useful for diagnosing why dialog steps are being canceled.",
      "savedSearch": "logserv_dispatcher_softcancel_reasons",
      "spl": "`sap_logserv_idx_macro` sourcetype=sap:abap:dispatcher \"reason=\" | rex field=_raw \"reason=(?<reason>[A-Z_]+)\" | timechart bins=90 minspan=1h count by reason limit=8 useother=t",
      "renderHint": "timechart",
      "chartPalette": "categorical",
      "interpretation": "Per-hour rate of ABAP dispatcher soft-cancel events broken down by reason code. AUTO_LOGOFF and SAP_GUI_DISCONNECT are routine; spikes in ICM_CANCEL_REQUEST or ICM_PROCESSING_TIMEOUT indicate frontend load or upstream slowness; GW_CANCEL_BY_RFC_PEER means an RFC partner gave up first.",
      "nextSteps": [
        {
          "text": "If ICM_PROCESSING_TIMEOUT dominates, run the webdispatcher_5xx_rate_trend prompt to see whether load-balancer-side timeouts correlate.",
          "savedSearch": "logserv_webdispatcher_5xx_rate_trend"
        },
        {
          "text": "If GW_CANCEL_BY_RFC_PEER spikes, run abap_gateway_failures for the same time range to find the failing RFC partner.",
          "savedSearch": "logserv_abap_gateway_failures"
        },
        "Sustained AUTO_LOGOFF dominance is normal idle behavior \u2014 investigate only if it suddenly stops."
      ],
      "dashboard": [
        "abap-operations",
        "work-process-performance"
      ]
    },
    {
      "id": "sap_basis.abap_gateway_failures",
      "pack": "sap_basis",
      "label": "ABAP gateway error events by detail",
      "description": "Counts sap:abap:gateway error events grouped by SID, host, and the extracted gw_error_detail field (NiBufIIn invalid data, NiIRead SI_ECONN_BROKEN, partner connection broken, and ~8 other diagnostic categories). Highlights which RFC partners are repeatedly failing protocol negotiation.",
      "savedSearch": "logserv_abap_gateway_failures",
      "spl": "`sap_logserv_idx_macro` sourcetype=sap:abap:gateway \"*** ERROR\" | stats count by sap_sid host gw_error_detail | sort -count",
      "renderHint": "table",
      "chartHint": "pie",
      "chartPalette": "categorical",
      "interpretation": "Gateway error events grouped by gw_error_detail category. NiBufIIn invalid-data = malformed RFC frame (often non-RFC traffic hitting an RFC port); SI_ECONN_BROKEN = remote peer gave up; partner-broken = sustained connection severed. The category mix tells you where the problem actually lives.",
      "nextSteps": [
        "NiBufIIn invalid-data spikes from a single peer indicate either a misconfigured client OR an attempted protocol probe \u2014 capture the peer IP and verify it's expected to be an RFC partner.",
        {
          "text": "Repeated 'connection to partner X broken' often correlates with the peer's own dispatcher errors \u2014 if the peer is also instrumented, run abap_workprocess_errors against it.",
          "savedSearch": "logserv_abap_workprocess_errors"
        },
        {
          "text": "If error volume is concentrated on one local SID, check that SID's network reachability via the sap_router_volume_trend prompt.",